{
  "manifestVersion": "1.0.0",
  "manifestId": "series-vikings-2026-scaffold-v1",
  "generatedAt": "2026-05-02T16:45:00Z",
  "seriesSlug": "vikings-2026",
  "assetSet": "series",
  "assets": [
    {
      "id": "series-vikings-2026-hero",
      "assetType": "series-hero",
      "assetRole": "scaffold",
      "prompt": "Wide cinematic hero image for Vikings 2026 series landing page.",
      "width": 2400,
      "height": 1350,
      "format": "jpg",
      "stagingPath": "staging/series/vikings-2026/series-hero.jpg",
      "finalRepoPath": "public/images/vikings-2026/series-hero.jpg",
      "finalPublicPath": "/images/vikings-2026/series-hero.jpg",
      "required": true,
      "allowRegeneration": true
    },
    {
      "id": "series-vikings-2026-key-art-reference",
      "assetType": "series-key-art-reference",
      "assetRole": "reference",
      "prompt": "Reference mood board image for typography and color direction.",
      "width": 1600,
      "height": 900,
      "format": "png",
      "stagingPath": "staging/series/vikings-2026/references/key-art-reference.png",
      "finalRepoPath": "public/images/vikings-2026/references/key-art-reference.png",
      "finalPublicPath": "/images/vikings-2026/references/key-art-reference.png",
      "required": false,
      "allowRegeneration": false
    }
  ]
}
